The wheels and gears of a machine are greased in order to decrease,potential energy,efficiency,output,friction,D,https://github.com/hendrycks/test,arc_easy.csv,673,0.398
The primary focus of the ?????systems approach????? to the problems of business and industry is to improve,organizational performance,work habits,organizational morale,individual morale,A,https://github.com/hendrycks/test,professional_psychology_test.csv,210,0.259
An industry that create a lot of waste is:,Solar Power Companies,Recycling companies,water production companies,Cleaning Companies,D,https://github.com/hendrycks/test,obqa.csv,2021,0.225
Which of the following is NOT a characteristic of perfectly competitive industry?,Free entry into the industry.,Product differentiation.,Perfectly elastic demand curve.,Homogeneous products.,B,https://github.com/hendrycks/test,high_school_microeconomics_test.csv,102,0.224
 Which of the following elements is not part of Porter's Five Forces model for industry competitiveness?,Threat of substitutes.,Threat of suppliers.,Power of buyers.,Threat from government.,D,https://github.com/hendrycks/test,marketing_test.csv,135,0.223
Which of the following is an example of a bulk-gaining industry?,Steel,Bottled orange juice,Paper,Copper,B,https://github.com/hendrycks/test,high_school_geography_test.csv,76,0.219
The industry that makes plastic army figures uses a small fraction of the plastic demanded for all purposes. On this basis, we can conclude that the army-figures industry is most likely a(n),"increasing-cost industry,constant-cost industry",decreasing-cost industry,profit-making industry,B,https://github.com/hendrycks/test,high_school_microeconomics_test.csv,10,0.216
Which of the following has the highest predictive validity in personnel selection in industry,A projective technique,An objective personality inventory,An interview by the personnel manager,A biographical inventory,D,https://github.com/hendrycks/test,professional_psychology_test.csv,396,0.216
A manufacturing industry has asked to relocate its plant to your town. From an environmental perspective, which question is least important to ask before deciding whether the industry may move to your town?,"How will the plant affect wildlife of the area?,What kinds of pollution will the plant produce?",What impact will the plant have on the population of the town?,What are the uses of the products that the plant will manufacture?,D,https://github.com/hendrycks/test,science_middle.csv,75,0.202
Which of the following is LEAST self-sufficient in the natural resources needed for modern industry?,United States,Japan,France,United Kingdom,B,https://github.com/hendrycks/test,high_school_geography_test.csv,35,0.177
Which is a way the agricultural biotechnology industry could have a positive impact on the environment?,by producing crops that are virus resistant,by making robots to replace large farm machines,by reducing the need for countries to import food,by increasing the use of wind farms that produce electricity,C,https://github.com/hendrycks/test,arc_easy.csv,1768,0.172
